{
  "schema_version": "handoff-v1",
  "agent": "software-engineer",
  "context": "dadaia-workspace",
  "produced_at": "2026-05-19T04:00:00Z",
  "release_id": "agents-r2-v1",
  "artifact": {
    "type": "report",
    "path": ".dadaia/reports/dadaia-workspace/software-engineer/2026-05-19T040000Z-P10-inline-scopes.html",
    "content_hash": "20e404db6bb788fa7dbfd9fc1eb7dd8fe18de4f741b6cea371d9a12b7a1245e4"
  },
  "findings": [
    {
      "severity": "INFO",
      "message": "AGT-r2-29: Scope section inlined into project-manager.md; wc -l = 300 (at limit)."
    },
    {
      "severity": "INFO",
      "message": "AGT-r2-30: Scope section inlined into project-auditor.md; 302 lines."
    },
    {
      "severity": "INFO",
      "message": "AGT-r2-31: Scope section inlined into design-specialist.md; 281 lines."
    },
    {
      "severity": "INFO",
      "message": "AGT-r2-32: 4 rule files archived to specs/_archive/legacy-rules/20260519T040000Z/; 2 rules remain."
    }
  ],
  "decisions_required": [],
  "next_handoff": {
    "agent": "devops-engineer",
    "context": "dadaia-workspace",
    "expected_artifact_type": "report"
  }
}
