{
  "schema_version": "handoff-v1",
  "agent": "product-engineer",
  "context": "dadaia-workspace",
  "produced_at": "2026-05-17T05:25:32Z",
  "release_id": "agent-monitoring-v1",
  "artifact": {
    "type": "report",
    "path": ".dadaia/reports/dadaia-workspace/product-engineer/2026-05-17T052532Z-agent-monitoring-discovery.html",
    "content_hash": "873f3badd93301753fb66a76065bcf12c668e46bd7c323a72625b5d21a7a6020"
  },
  "findings": [
    { "severity": "CRITICAL", "message": "jsonl contains operator prompts verbatim; panel must never expose content fields or transcript endpoints." },
    { "severity": "HIGH", "message": "No Anthropic Admin API — cost is computed from a versioned local pricing table; staleness must surface in the UI." },
    { "severity": "MEDIUM", "message": "Codex thread_id does not correlate with Claude Code sessionId; do not attempt cross-provider session fusion." },
    { "severity": "MEDIUM", "message": "Large jsonl files require incremental tail + checkpoint; DoS surface to be addressed by software-architect + devops-engineer." },
    { "severity": "INFO", "message": "Five operator defaults registered explicitly in lieu of grill-me; each marked overridable at the approval gate." }
  ],
  "decisions_required": [
    "Retention policy: accept default of 180d raw + perpetual aggregates, or set explicit TTL.",
    "Pricing table source of truth: in-repo Python module (auditable) vs ~/.dadaia/config/pricing.json (operator-editable).",
    "Include opencode telemetry in v1 or defer to v1.1.",
    "Canonical source for the Workflows map (.claude/skills/ vs specs/releases/*/PLAN.md vs other).",
    "Treatment of events whose cwd falls outside any registered Spec Context (bucket 'unassigned' or discard).",
    "Whether the panel emits threshold alerts (e.g. cost-per-day per agent) or stays purely informational.",
    "Whether the local panel adds an auth token now that cost telemetry is exposed, or keeps 127.0.0.1 unauthenticated."
  ],
  "next_handoff": {
    "agent": "software-architect",
    "context": "dadaia-workspace",
    "expected_artifact_type": "report"
  }
}
