{
  "schema_version": "handoff-v1",
  "agent": "software-engineer",
  "context": "dadaia-workspace",
  "produced_at": "2026-05-17T06:49:15Z",
  "release_id": "dadaia-workspace-brand-identity-v1",
  "artifact": {
    "type": "report",
    "path": ".dadaia/reports/dadaia-workspace/software-engineer/2026-05-17T064915Z-spec-context-isolation-rca.html",
    "content_hash": "3c46712f663b66890f8c96d31bc5fcb8dc5aa9cc7f2fd1875d11aa9ba9aaa5d8"
  },
  "findings": [
    {
      "severity": "MEDIUM",
      "message": "primary_context.json is a single global file with no session-id, PID, or lockfile. Any dadaia context activate call from any process overwrites it, leaking state across concurrent Claude Code sessions."
    },
    {
      "severity": "MEDIUM",
      "message": "dadaia context use prints export DADAIA_CONTEXT=<name> but does not execute it. Inside Claude Code sessions env vars are not persisted across tool calls, making the isolation mechanism effectively inert."
    },
    {
      "severity": "INFO",
      "message": "Resolution order confirmed: DADAIA_CONTEXT env var (ctx-inject.sh line 11) takes priority over primary_context.json. Isolation is possible if operator exports the var at session start."
    }
  ],
  "decisions_required": [
    "Approve fix option (b): hook detects CLAUDE_SESSION_ID and uses session-scoped override file. Requires product-engineer to create a hotfix spec before software-engineer implements.",
    "Confirm whether CLAUDE_SESSION_ID is a stable env var in Claude Code runtime, or select PID as fallback session key."
  ],
  "next_handoff": {
    "agent": "product-engineer",
    "context": "dadaia-workspace",
    "expected_artifact_type": "spec"
  }
}
