{
  "schema_version": "handoff-v1",
  "agent": "product-engineer",
  "context": "dadaia-workspace",
  "produced_at": "2026-05-17T07:06:06Z",
  "release_id": "dadaia-workspace-brand-identity-v1",
  "artifact": {
    "type": "report",
    "path": ".dadaia/reports/dadaia-workspace/product-engineer/2026-05-17T070606Z-brand-identity-acceptance.html",
    "content_hash": "0a52100e9c9557285c8455a8cf3a70b225de351e7afa0d46cb60b7839d9a2e22"
  },
  "findings": [
    {
      "severity": "INFO",
      "message": "All 12 tasks (T-BR-01..12) marked [x]. 15 brand-identity tests passing. dadaia doctor green. Smoke curl confirms 5 tokens + topbar-logo + rhino SVG + wordmark color all render."
    }
  ],
  "decisions_required": [
    "Operator visually validates panel via `dadaia panel` before merging the PR.",
    "Operator merges PR feat/brand-identity-v1 -> main when satisfied.",
    "Operator optionally elects agent-monitoring-v1 as next ACTIVE release."
  ]
}
