{
  "schema_version": "handoff-v1",
  "agent": "devops-engineer",
  "context": "dadaia-workspace",
  "produced_at": "2026-05-19T19:29:45Z",
  "release_id": "agents-r3-v1",
  "artifact": {
    "type": "report",
    "path": ".dadaia/reports/dadaia-workspace/devops-engineer/2026-05-19T192945Z-agents-r3-v1-p5-doctor-checkpoint.html",
    "content_hash": "d2f9d8be42eb03e11b0f3a011be22ca9e50187eafad34a15fac52da6b8852fed"
  },
  "findings": [
    { "severity": "INFO", "message": "P5 complete: dadaia public stage + install --target all + doctor green; dadaia specs doctor 0/0; full pytest sweep green after fixing 13 stale-count test failures." },
    { "severity": "INFO", "message": "Workspace-root projections at 20 agents; repo-level projections inside repos/dadaia-workspace/ manually synced from workspace canonical (install scope is workspace-root only)." },
    { "severity": "LOW", "message": "Known pre-existing failure deferred to backlog: tests/integration/test_cli_reports.py::test_10_workspace_not_initialized_exits_3 expects exit code 3 but CLI exits 1 with WorkspaceNotInitializedError. Not introduced by r3." },
    { "severity": "LOW", "message": "DRIFT: tests/e2e/features/test_orchestration_pipeline.py expected synthesis to be terminal but post-r5 spec-refinement.workflow.md adds a spec_write stage. Test extended through spec_write as part of R3-27 — pre-existing bug exposed by P5 sweep." },
    { "severity": "INFO", "message": "design-specialist.md frontmatter had dangling skill reference to non-existent 'frontend-design'; removed (ux-ui-review covers the use case). Re-staged + re-installed." }
  ],
  "decisions_required": [],
  "next_handoff": {
    "agent": "product-engineer",
    "context": "dadaia-workspace",
    "expected_artifact_type": "report"
  }
}
