{
  "schema_version": "handoff-v1",
  "agent": "product-engineer",
  "context": "dadaia-workspace",
  "produced_at": "2026-05-19T02:03:29Z",
  "release_id": "agents-r2-v1",
  "artifact": {
    "type": "tasks",
    "path": ".dadaia/reports/dadaia-workspace/product-engineer/2026-05-19T020329Z-agents-r2-v1-tasks-drafted.html",
    "content_hash": "48dec1402b4f12fe0aa1c02ead133379a68afa338d85b335e37eeb22abd5cdd5"
  },
  "findings": [
    { "severity": "INFO", "message": "TASKS.md authored with 53 tasks (AGT-r2-01..53) across phases P0..P14; total 322 lines (under 600-line cap)." },
    { "severity": "INFO", "message": "Parallel windows W1/W2/W3/W4 annotated on the first task of each parallel phase." },
    { "severity": "INFO", "message": "dadaia specs doctor reports 0 errors / 0 warnings post-write." },
    { "severity": "LOW", "message": "Four tasks flagged risky: AGT-r2-19 (gate fail-open), AGT-r2-25/27 (R14 self-projection), AGT-r2-33 (forbidden-strings grep), AGT-r2-37/44 (FR10 operator step)." }
  ],
  "decisions_required": [
    "Operator review/approval of the 53-task implementation breakdown before phase advances to IMPLEMENTATION."
  ],
  "next_handoff": {
    "agent": "project-manager",
    "context": "dadaia-workspace",
    "expected_artifact_type": "report"
  }
}
