{
  "schema_version": "handoff-v1",
  "agent": "software-architect",
  "context": "dadaia-workspace",
  "produced_at": "2026-05-17T05:29:32Z",
  "release_id": "agent-monitoring-v1",
  "artifact": {
    "type": "report",
    "path": ".dadaia/reports/dadaia-workspace/software-architect/2026-05-17T052932Z-agent-monitoring-architecture.html",
    "content_hash": "e7194df2ebebf1ec64cb0349b8103f88dde668b1159d2a81b5291569341eecf7"
  },
  "findings": [
    { "severity": "HIGH", "message": "Composition root must inject TelemetryService into PanelService; declare in specs/memory/architecture.html before first PR to prevent DIP regression." },
    { "severity": "MEDIUM", "message": "Handler regex-dispatch needs /api/agents and /api/workflows; _NOT_FOUND_BODY must stay synchronized with _RAW_ROUTES." },
    { "severity": "MEDIUM", "message": "Privacy invariant must be enforced at aggregator dataclass level, not only at handler — no content/text/prompt/response/thinking fields in telemetry dataclasses." },
    { "severity": "LOW", "message": "Place SQLite + lock under ~/.dadaia/state/telemetry/ subdir to avoid ownership ambiguity with CLI state files." },
    { "severity": "INFO", "message": "SQLite local with WAL retained over file-per-day JSON aggregate; rationale in trade-off table." },
    { "severity": "INFO", "message": "Lazy-on-request ingestion selected over cron/inotify/daemon — zero background process, stdlib only." }
  ],
  "decisions_required": [
    "D10 confirm: pricing table as in-repo Python module (auditable, requires PR) vs ~/.dadaia/config/pricing.json (operator-editable). Architect picked Python; operator may override in Phase 3 grill-me.",
    "Composition root location must be declared in specs/memory/architecture.html before software-engineer starts implementation.",
    "Migration of the 14 architecture decisions from this discovery HTML into specs/memory/architecture.html (SPEC-DOC-008 memory atomicity)."
  ],
  "next_handoff": {
    "agent": "devops-engineer",
    "context": "dadaia-workspace",
    "expected_artifact_type": "report"
  }
}
