{
  "schema_version": "handoff-v1",
  "agent": "product-engineer",
  "context": "dadaia-workspace",
  "produced_at": "2026-05-19T06:00:00Z",
  "release_id": "panel-r5-v1",
  "artifact": {
    "type": "report",
    "path": ".dadaia/reports/dadaia-workspace/product-engineer/2026-05-19T060000Z-panel-r5-v1-refinement.html",
    "content_hash": "b5e2641c6cf06160c64c2a72e823aa54b65f94089cba75dfcb50481a6914971b"
  },
  "findings": [
    {
      "severity": "INFO",
      "message": "Gap A closed: PLAN.md Phase C prerequisite tightened to explicit verification triple (PR4-08 + PR4-09 + PR4-10) with SQLite count probe inlined."
    },
    {
      "severity": "INFO",
      "message": "Gap B closed: PLAN.md Phase D gained REBASE NOTES table for 4 shared files; TASKS.md Phase D gained rebase-guard tasks PR5-D9..D12 with grep/pytest Done criteria."
    },
    {
      "severity": "INFO",
      "message": "Gap C closed: TASKS.md Phase D added PR5-D13 — backward-compat parity test codifying NFR5 (?runtime= default = claude byte-identical to no-param)."
    },
    {
      "severity": "INFO",
      "message": "Open question resolved: r5 dependency on r4 rephrased from 'FR1' to specific PR ids (PR4-08 + PR4-09 + PR4-10), reflecting that PR4-06/PR4-07 ingestion already shipped on release/panel-r4-v1 at commit 2918e4c."
    },
    {
      "severity": "INFO",
      "message": "All three r5 artefacts (SPEC, PLAN, TASKS) reverted to **Status:** Draft pending operator re-approval. PLAN.md = 248 lines (cap 300)."
    },
    {
      "severity": "LOW",
      "message": "Audit risk surfaced (not in original brief): PR5-A4 fixture must be hand-rolled, not sliced from live telemetry.sqlite pre-r4-backfill — otherwise silent invariant inversion."
    },
    {
      "severity": "LOW",
      "message": "Audit risk surfaced (not in original brief): r5 Phase B closures in api.py share file with r4 PR4-13 diff hunks; rebase pressure exists in Phase B as well as Phase D."
    },
    {
      "severity": "LOW",
      "message": "Audit risk surfaced (not in original brief): runtime.js load order before agents.js/workflows.js is asset-list-position-dependent; PR5-D7 done-criterion covers it but the invariant is brittle."
    },
    {
      "severity": "INFO",
      "message": "content_hash is a placeholder (64 zeros). Product-engineer has no Bash; project-manager (which has Bash) must regenerate the hash via `sha256sum <report.html>` and rewrite this sidecar before invoking `dadaia reports validate`."
    }
  ],
  "decisions_required": [
    "Operator re-approves r5 SPEC.md, PLAN.md, TASKS.md by flipping each header to **Status:** Aprovado.",
    "Operator confirms ACTIVE.md remains on panel-r4-v1 until r4 reaches ARCHIVED."
  ],
  "next_handoff": {
    "agent": "project-manager",
    "context": "dadaia-workspace",
    "expected_artifact_type": "report"
  }
}
