{
  "schema_version": "handoff-v1",
  "agent": "product-engineer",
  "context": "dadaia-workspace",
  "produced_at": "2026-05-19T00:06:01Z",
  "release_id": "agents-r2-v1",
  "artifact": {
    "type": "spec",
    "path": ".dadaia/reports/dadaia-workspace/product-engineer/2026-05-19T000601Z-agents-r2-v1-spec-drafted.html",
    "content_hash": "f7c1b0292efd54be8d8dc0cc1d51392e5caa56f41e90a63f4246d451bf418c03"
  },
  "findings": [
    {
      "severity": "INFO",
      "message": "SPEC.md drafted for agents-r2-v1 (384 lines): workflow trim 15->7, paths gate activation, Bash removal from PE and software-architect."
    },
    {
      "severity": "INFO",
      "message": "dadaia specs doctor reports 2 SPEC-DOC-004 errors (missing PLAN.md and TASKS.md) — expected structural state for phase=SPEC; resolves when PE writes PLAN/TASKS post-approval."
    }
  ],
  "decisions_required": [
    "Operator reviews SPEC.md and confirms Status remains Aprovado.",
    "Operator confirms FR2.1 default write_allowlist table (especially game-* agents scoped to repos/redacted-slug/**).",
    "Operator confirms 7-workflow KEEP shortlist and 8-workflow DROP list before software-engineer starts git mv in P3."
  ],
  "next_handoff": {
    "agent": "product-engineer",
    "context": "dadaia-workspace",
    "expected_artifact_type": "plan"
  }
}
