{
  "schema_version": "handoff-v1",
  "agent": "backend-engineer",
  "context": "dadaia-workspace",
  "produced_at": "2026-05-19T16:01:59Z",
  "release_id": "panel-r5-v1",
  "artifact": {
    "type": "report",
    "path": ".dadaia/reports/dadaia-workspace/backend-engineer/2026-05-19T160159Z-panel-r5-v1-phase-e-be.html",
    "content_hash": "07382e884490b3b46d99eabcac0d1afb30bb49625e4480280d13dc67a2160317"
  },
  "findings": [
    {
      "severity": "INFO",
      "message": "PR5-E1: CodexRuntimeAdapter.liveness fully implemented. Reads threads.updated_at (Unix seconds) and threads.archived from ~/.codex/state_5.sqlite via read-only URI. Tails ~/.codex/history.jsonl (last 200 lines) for most recent ts per session_id. Uses max(updated_at, history_ts) as activity signal. Gracefully returns idle on any failure."
    },
    {
      "severity": "INFO",
      "message": "PR5-E2: Pricing audit complete. compute_cost is never called for Codex rows. CodexRuntimeAdapter.enrich_row sets cumulative_cost_usd=None directly. TelemetryService._backfill_costs naturally skips Codex events (OpenAI model names absent from PRICING_TABLE). No defensive guard in pricing.py needed."
    },
    {
      "severity": "INFO",
      "message": "Schema discovery: threads.id (TEXT PK), updated_at (INTEGER Unix seconds), archived (INTEGER 0/1). updated_at_ms column also exists (milliseconds) but unused — consistent with history.jsonl ts which is also Unix seconds."
    },
    {
      "severity": "INFO",
      "message": "Live smoke test: adapter.liveness('fake-id', '/tmp') returns idle (graceful degradation). Live threads from operator ~/.codex/state_5.sqlite all classified as ended (old sessions)."
    }
  ],
  "next_handoff": {
    "agent": "frontend-engineer",
    "context": "dadaia-workspace",
    "expected_artifact_type": "other"
  }
}
