{
  "schema_version": "handoff-v1",
  "agent": "software-engineer",
  "context": "dadaia-workspace",
  "produced_at": "2026-05-19T12:00:00Z",
  "release_id": "agents-r2-v1",
  "artifact": {
    "type": "report",
    "path": ".dadaia/reports/dadaia-workspace/software-engineer/2026-05-19T120000Z-P12-skill-wiring.html",
    "content_hash": "95e0cdf4c38a9a1cc0d2ea9a30ead2a39ee525bbed9031b83a56ca9ac32a76d8"
  },
  "findings": [
    {
      "severity": "INFO",
      "message": "AGT-r2-39: dadaia-workspace-doctor wired into devops-engineer and project-manager (2 hits confirmed)."
    },
    {
      "severity": "INFO",
      "message": "AGT-r2-40: dev-server-registry wired into frontend-engineer (1 hit confirmed)."
    },
    {
      "severity": "INFO",
      "message": "AGT-r2-41: tests/scripts/check_skill_orphans.py authored (44 lines); exits 0 on clean tree, exits 1 with orphan name in stderr when seeded."
    },
    {
      "severity": "INFO",
      "message": "Adjacent fix: test_install_all_projects_runtime_assets updated to reflect dadaia-workspace-dev-guardrail.md archival (AGT-r2-32); 2 remaining rules asserted instead."
    },
    {
      "severity": "LOW",
      "message": "Pre-existing P11a breakage: test_install_overwrites_existing_files_with_force fails because AGENTS.md header changed. Outside P12 write set; noted for P11a owner."
    }
  ],
  "decisions_required": [],
  "next_handoff": {
    "agent": "qa-engineer",
    "context": "dadaia-workspace",
    "expected_artifact_type": "report"
  }
}
