{
  "schema_version": "handoff-v1",
  "agent": "product-engineer",
  "context": "dadaia-workspace",
  "produced_at": "2026-05-19T03:50:13Z",
  "release_id": "agents-r2-v1",
  "artifact": {
    "type": "report",
    "path": ".dadaia/reports/dadaia-workspace/product-engineer/2026-05-19T035013Z-P11a-data-agents-rewrite.html",
    "content_hash": "dafc02c0c7c91b9482d7474b64b60efa04efbfec84b191cdf1b58db541824d5c"
  },
  "findings": [
    { "severity": "INFO", "message": "AGT-r2-33 closed: data/AGENTS.md rewritten to 276 lines (<= 280 budget); forbidden-strings grep exits clean (FR7.2)." },
    { "severity": "INFO", "message": "AGT-r2-34 closed: data/CLAUDE.md absence verified at filesystem level + anchored as Case 7 unit test (7/7 cases pass)." },
    { "severity": "INFO", "message": "All 11 FR7.9 sections present; lib-general scope only; absorbed dadaia-workspace-dev-guardrail.md content into Section 5." }
  ],
  "decisions_required": [],
  "next_handoff": {
    "agent": "software-engineer",
    "context": "dadaia-workspace",
    "expected_artifact_type": "report"
  }
}
