{
  "schema_version": "handoff-v1",
  "agent": "product-engineer",
  "context": "dadaia-workspace",
  "produced_at": "2026-05-19T00:15:56Z",
  "release_id": "agents-r2-v1",
  "artifact": {
    "type": "report",
    "path": ".dadaia/reports/dadaia-workspace/product-engineer/2026-05-19T001556Z-agents-r2-v1-spec-expanded.html",
    "content_hash": "e9c3a7cc3872bee8aa399c58a119e92f8edc21828e062391efe27d256d8df08c"
  },
  "findings": [
    {
      "severity": "INFO",
      "message": "SPEC expanded from FR1-FR5 (385 lines) to FR1-FR9 (685 lines); FR1-FR5 preserved verbatim. Acceptance criteria extended C1-C13 -> C1-C20; risks R1-R7 -> R1-R12; out-of-scope NS1-NS9 -> NS1-NS13; phase plan P0-P10 -> P0-P14."
    },
    {
      "severity": "INFO",
      "message": "All 5 audit findings (A-E) verified via grep before incorporation: 6 rule files confirmed in public/rules/, 2 orphan skills confirmed (dadaia-workspace-doctor, dev-server-registry), AGENTS.md contains Hostinger/Hermes/OpenClaw strings, AGENTS.md inventory lists only 6 of 16 agents."
    },
    {
      "severity": "MEDIUM",
      "message": "R9 (AGENTS.md projection drift across consumers) and R12 (rules cleanup-on-absence in public_assets.py installer) recorded as MEDIUM risks; both depend on installer behavior that devops-engineer must verify in P13 (second projection sweep)."
    }
  ],
  "decisions_required": [
    "Operator approval of expanded SPEC (FR6-FR9 added) to unblock PLAN.md authoring.",
    "Operator confirmation that workspace CLAUDE.md (Hostinger/Hermes/OpenClaw content) stays untouched per NS10.",
    "Operator confirmation that FR9 (multi-agent-orchestration-v{1,2}.md archival) is a CLOSURE-time decision, not implementation-time silent move."
  ],
  "next_handoff": {
    "agent": "product-engineer",
    "context": "dadaia-workspace",
    "expected_artifact_type": "plan"
  }
}
