{
  "schema_version": "handoff-v1",
  "agent": "software-engineer",
  "context": "dadaia-workspace",
  "produced_at": "2026-05-19T00:00:00Z",
  "release_id": "agents-r2-v1",
  "artifact": {
    "type": "report",
    "path": ".dadaia/reports/dadaia-workspace/software-engineer/2026-05-19T000000Z-P11b-wire-installer.html",
    "content_hash": "3d0de1ac4a873ab338ed8e154178d525a774bb70b2a2fb74851ff7531f79079a"
  },
  "findings": [
    {
      "severity": "INFO",
      "message": "AGT-r2-35: install() now calls _install_workspace_guardrail_pair for data/AGENTS.md, producing 4 guardrail files per workspace run. Legacy _install_agents_md retained for templates/AGENTS.md scaffolder path."
    },
    {
      "severity": "INFO",
      "message": "AGT-r2-36: dadaia public stage recomputed manifest SHA-256 for data/AGENTS.md. data/CLAUDE.md absent from manifest (grep count=0). doctor reports [ok] for stage:data/AGENTS.md, root:AGENTS.md, root:CLAUDE.md."
    },
    {
      "severity": "INFO",
      "message": "11 unit + integration tests pass (8 in test_workspace_guardrail_pair.py, 3 in test_public_install_e2e.py). No drift or missing entries in doctor output."
    }
  ],
  "decisions_required": [],
  "next_handoff": {
    "agent": "qa-engineer",
    "context": "dadaia-workspace",
    "expected_artifact_type": "report"
  }
}
