{
  "schema_version": "handoff-v1",
  "agent": "product-engineer",
  "context": "dadaia-workspace",
  "produced_at": "2026-05-17T20:30:00Z",
  "release_id": "v0.1.1",
  "artifact": {
    "type": "report",
    "path": ".dadaia/reports/dadaia-workspace/product-engineer/2026-05-17T203000Z-dev-server-registry-hotfix-acceptance.html",
    "content_hash": "d5120e00e7e2d4884b51a4782e5e69f6b2ef874f8c4f70a21430460ea62e68d3"
  },
  "findings": [
    {
      "severity": "INFO",
      "message": "v0.1.1 hotfix acceptance pass — all 12 SPEC acceptance criteria and all 10 tasks T-DSR-01..10 marked done. 4 bugs closed (A resolver / B corrupt-JSON / C probe / D scan+UI gap). 635 unit tests passing (was 595 pre-hotfix; +40 net new). Live end-to-end smoke covers sub-repo CLI invocation, controlled orphan detection (loopback + LAN-exposed), register-removes-from-scan, ruff format/check/mypy/specs-doctor all green. Backwards-compatible: /api/servers payload adds 'unregistered' key; resolver returns same path for already-correct workspaces. Branch: hotfix/dev-server-registry-v0.1.1 with 6 commits (P0..P5)."
    }
  ],
  "decisions_required": [
    "After PR #9 (agent-monitoring-v1) merges to main, rebase hotfix/dev-server-registry-v0.1.1 onto updated main and open the hotfix PR via 'gh pr create --base main'.",
    "Operator visually validates the panel Unregistered section by restarting 'dadaia panel' and observing the new section beneath the Servers table."
  ]
}
