{
  "schema_version": "handoff-v1",
  "agent": "software-engineer",
  "context": "dadaia-workspace",
  "produced_at": "2026-05-19T03:33:36Z",
  "release_id": "agents-r2-v1",
  "artifact": {
    "type": "report",
    "path": ".dadaia/reports/dadaia-workspace/software-engineer/2026-05-19T033336Z-P9-guardrail-pair.html",
    "content_hash": "cfbd46e8fbfed0e32cffa865447e283cf0290e56fc97564cf9c3c34ec63a6701"
  },
  "findings": [
    {
      "severity": "INFO",
      "message": "AGT-r2-25 and AGT-r2-26 complete. _install_workspace_guardrail_pair and _doctor_guardrail_pair implemented. _runtime_expectations extended to emit 4 tuples. 5 integration tests green. 6 xfail unit tests now xpassed (strict=False). Pre-existing unit failure (test_install_all_projects_runtime_assets) predates P9."
    }
  ],
  "decisions_required": [],
  "next_handoff": {
    "agent": "qa-engineer",
    "context": "dadaia-workspace",
    "expected_artifact_type": "report"
  }
}
