{
  "schema_version": "handoff-v1",
  "agent": "software-engineer",
  "context": "dadaia-workspace",
  "produced_at": "2026-05-18T12:00:00Z",
  "release_id": "agents-r2-v1",
  "artifact": {
    "type": "report",
    "path": ".dadaia/reports/dadaia-workspace/software-engineer/2026-05-18T120000Z-P3-bash-removal.html",
    "content_hash": "764ed1b74c92dc30a271392fbb34ff94bf2f242ca6ca1eb1097be5e13dab7ead"
  },
  "findings": [
    {
      "severity": "INFO",
      "message": "AGT-r2-10: Bash removed from product-engineer frontmatter; all bash fenced blocks and shell invocations delegated to PM via briefing or delegation notes."
    },
    {
      "severity": "INFO",
      "message": "AGT-r2-11: Bash removed from software-architect frontmatter; body references to Bash in ONBOARD/REVIEW flow and Tooling Reference section updated to use Read/Glob/Grep + PM delegation table."
    }
  ],
  "decisions_required": [],
  "next_handoff": {
    "agent": "devops-engineer",
    "context": "dadaia-workspace",
    "expected_artifact_type": "report"
  }
}
