{
  "schema_version": "handoff-v1",
  "agent": "qa-engineer",
  "context": "dadaia-workspace",
  "produced_at": "2026-05-18T16:00:00Z",
  "release_id": "dadaia-workspace-panel-r3-v1",
  "artifact": {
    "type": "report",
    "path": ".dadaia/reports/dadaia-workspace/qa-engineer/2026-05-18T160000Z-pr3-22-evidence.html",
    "content_hash": "d8c6d3564cef02b54427a44f6fd131af935d74a037ac2bf62718a6d13bb2cf72"
  },
  "findings": [
    { "severity": "INFO",  "message": "21 of 21 screenshots captured per QA test plan section 4." },
    { "severity": "INFO",  "message": "6 of 6 axe-core scans pass with 0 critical and 0 serious violations across Mint/Sage/Warm x Agents/Workflows." },
    { "severity": "LOW",   "message": "2 moderate axe-core violations per combo deferred to post-release backlog (not blockers per SPEC section 13 DoD #7)." },
    { "severity": "HIGH",  "message": "Five real application regressions discovered during E2E pressure were fixed before this evidence: 35e96ce, 296ffcc, a802e44, f074a0a, b859d3f." }
  ],
  "next_handoff": {
    "agent": "product-engineer",
    "context": "dadaia-workspace",
    "expected_artifact_type": "closure"
  }
}
